content,creation_date,last_change_date,user_id,post_id
scelerisque mauris sit amet eros suspendisse accumsan,1724597494,1732051792,10,27
eget tincidunt eget tempus vel pede morbi porttitor,1704419176,1732051792,13,5
rutrum at lorem integer tincidunt ante vel ipsum praesent,1707359315,1732051792,5,16
maecenas tincidunt lacus at velit vivamus vel nulla eget eros,1730527641,1732051792,8,27
et ultrices posuere cubilia curae nulla dapibus dolor,1718530494,1732051792,2,15
ut odio cras mi pede malesuada in,1715996919,1732051792,6,7
blandit mi in porttitor pede,1728800650,1732051792,8,29
velit eu est congue elementum in hac habitasse platea,1709553897,1732051792,30,29
lectus vestibulum quam sapien varius,1721810639,1732051792,16,4
ut blandit non interdum in,1724160093,1732051792,15,9
pretium iaculis diam erat fermentum justo,1707713202,1732051792,25,10
lacinia erat vestibulum sed magna at nunc commodo,1721885190,1732051792,8,28
integer ac neque duis bibendum morbi non,1717750736,1732051792,19,14
amet justo morbi ut odio cras mi pede malesuada in,1727146935,1732051792,30,13
justo aliquam quis turpis eget elit sodales scelerisque mauris sit,1717168702,1732051792,24,25
ut rhoncus aliquet pulvinar sed nisl nunc rhoncus,1711820649,1732051792,10,15
ipsum dolor sit amet consectetuer adipiscing elit proin interdum,1730039406,1732051792,11,30
vivamus vestibulum sagittis sapien cum sociis natoque penatibus et magnis,1723538559,1732051792,22,24
libero nullam sit amet turpis elementum ligula vehicula,1710575845,1732051792,26,1
donec pharetra magna vestibulum aliquet ultrices,1714409273,1732051792,19,20
neque libero convallis eget eleifend luctus ultricies eu,1730531729,1732051792,22,11
platea dictumst aliquam augue quam sollicitudin vitae consectetuer eget rutrum,1713322879,1732051792,9,2
lacus curabitur at ipsum ac tellus semper interdum mauris ullamcorper,1711895094,1732051792,12,9
aliquam augue quam sollicitudin vitae consectetuer eget,1731845505,1732051792,12,6
amet consectetuer adipiscing elit proin interdum mauris non,1711747382,1732051792,12,1
primis in faucibus orci luctus et,1726602146,1732051792,5,5
hac habitasse platea dictumst aliquam,1706382872,1732051792,5,26
massa volutpat convallis morbi odio,1709798387,1732051792,21,11
parturient montes nascetur ridiculus mus,1724091287,1732051792,12,23
eros viverra eget congue eget semper rutrum nulla nunc,1728218553,1732051792,13,18
tincidunt lacus at velit vivamus vel,1701620961,1732051792,19,17
massa tempor convallis nulla neque libero,1709596252,1732051792,27,23
ultrices posuere cubilia curae mauris viverra,1717844929,1732051792,4,15
at lorem integer tincidunt ante vel ipsum praesent,1716501726,1732051792,30,23
rhoncus aliquet pulvinar sed nisl nunc rhoncus,1727976666,1732051792,23,13
luctus et ultrices posuere cubilia curae,1711460241,1732051792,21,28
tincidunt eget tempus vel pede morbi porttitor,1711358916,1732051792,19,3
dignissim vestibulum vestibulum ante ipsum primis in,1719199545,1732051792,16,4
sodales scelerisque mauris sit amet eros suspendisse accumsan,1713672011,1732051792,6,13
ipsum praesent blandit lacinia erat vestibulum sed magna at nunc,1702971173,1732051792,5,27
dui vel sem sed sagittis nam congue risus semper,1725235403,1732051792,4,25
consectetuer eget rutrum at lorem integer tincidunt ante,1725165977,1732051792,10,11
est risus auctor sed tristique in tempus,1721128062,1732051792,15,13
est quam pharetra magna ac consequat metus sapien ut,1720609706,1732051792,12,9
vel nulla eget eros elementum pellentesque,1730488101,1732051792,17,15
erat vestibulum sed magna at,1705280869,1732051792,5,1
condimentum id luctus nec molestie sed justo,1701189834,1732051792,11,25
in quis justo maecenas rhoncus,1708519689,1732051792,27,1
metus vitae ipsum aliquam non mauris morbi,1705977122,1732051792,7,28
leo odio condimentum id luctus nec molestie sed,1728010834,1732051792,7,21
